{
  "exam": "nso",
  "grade": 10,
  "title": "NSO Grade 10 Syllabus",
  "description": "Grade 10 science: advanced physics, chemistry, biology, advanced concepts.",
  "topics": [
    {
      "code": "NSO-G10-T1",
      "name": "Physics Basics",
      "description": "Motion, force, energy.",
      "weightage": "high",
      "recommendedQuestionCount": 50,
      "subtopics": [
        {
          "code": "NSO-G10-T1-S1",
          "name": "Mechanics",
          "description": "Physics concepts.",
          "learningObjectives": [
            "Apply physics principles",
            "Solve problems"
          ],
          "difficultyRange": [
            "easy",
            "medium",
            "hard"
          ],
          "recommendedQuestionCount": 25,
          "tags": [
            "physics",
            "nso",
            "grade10"
          ]
        },
        {
          "code": "NSO-G10-T1-S2",
          "name": "Waves and Energy",
          "description": "Energy forms.",
          "learningObjectives": [
            "Explain concepts",
            "Apply to situations"
          ],
          "difficultyRange": [
            "easy",
            "medium",
            "hard"
          ],
          "recommendedQuestionCount": 25,
          "tags": [
            "physics",
            "nso",
            "grade10"
          ]
        }
      ]
    },
    {
      "code": "NSO-G10-T2",
      "name": "Chemistry Basics",
      "description": "Matter and reactions.",
      "weightage": "high",
      "recommendedQuestionCount": 50,
      "subtopics": [
        {
          "code": "NSO-G10-T2-S1",
          "name": "Matter and Changes",
          "description": "Chemical concepts.",
          "learningObjectives": [
            "Describe reactions",
            "Balance equations"
          ],
          "difficultyRange": [
            "easy",
            "medium",
            "hard"
          ],
          "recommendedQuestionCount": 25,
          "tags": [
            "chemistry",
            "nso",
            "grade10"
          ]
        },
        {
          "code": "NSO-G10-T2-S2",
          "name": "Acids, Bases, and Salts",
          "description": "Chemical properties.",
          "learningObjectives": [
            "Identify types",
            "Explain properties"
          ],
          "difficultyRange": [
            "easy",
            "medium",
            "hard"
          ],
          "recommendedQuestionCount": 25,
          "tags": [
            "chemistry",
            "nso",
            "grade10"
          ]
        }
      ]
    },
    {
      "code": "NSO-G10-T3",
      "name": "Biology Basics",
      "description": "Life sciences.",
      "weightage": "high",
      "recommendedQuestionCount": 55,
      "subtopics": [
        {
          "code": "NSO-G10-T3-S1",
          "name": "Cells and Organisms",
          "description": "Life processes.",
          "learningObjectives": [
            "Describe cell biology",
            "Explain life processes"
          ],
          "difficultyRange": [
            "easy",
            "medium",
            "hard"
          ],
          "recommendedQuestionCount": 28,
          "tags": [
            "biology",
            "nso",
            "grade10"
          ]
        },
        {
          "code": "NSO-G10-T3-S2",
          "name": "Human Body and Health",
          "description": "Body systems.",
          "learningObjectives": [
            "Describe systems",
            "Explain health"
          ],
          "difficultyRange": [
            "easy",
            "medium",
            "hard"
          ],
          "recommendedQuestionCount": 27,
          "tags": [
            "biology",
            "nso",
            "grade10"
          ]
        }
      ]
    },
    {
      "code": "NSO-G10-T4",
      "name": "Earth and Environment",
      "description": "Earth science.",
      "weightage": "medium",
      "recommendedQuestionCount": 40,
      "subtopics": [
        {
          "code": "NSO-G10-T4-S1",
          "name": "Earth Science",
          "description": "Earth processes.",
          "learningObjectives": [
            "Describe Earth systems",
            "Explain phenomena"
          ],
          "difficultyRange": [
            "easy",
            "medium",
            "hard"
          ],
          "recommendedQuestionCount": 20,
          "tags": [
            "earth",
            "nso",
            "grade10"
          ]
        },
        {
          "code": "NSO-G10-T4-S2",
          "name": "Environment",
          "description": "Ecology and conservation.",
          "learningObjectives": [
            "Explain ecology",
            "Discuss conservation"
          ],
          "difficultyRange": [
            "easy",
            "medium",
            "hard"
          ],
          "recommendedQuestionCount": 20,
          "tags": [
            "environment",
            "nso",
            "grade10"
          ]
        }
      ]
    },
    {
      "code": "NSO-G10-T5",
      "name": "Scientific Reasoning",
      "description": "Experimental thinking.",
      "weightage": "medium",
      "recommendedQuestionCount": 35,
      "subtopics": [
        {
          "code": "NSO-G10-T5-S1",
          "name": "Experimental Design",
          "description": "Scientific method.",
          "learningObjectives": [
            "Design experiments",
            "Analyze data"
          ],
          "difficultyRange": [
            "easy",
            "medium",
            "hard"
          ],
          "recommendedQuestionCount": 18,
          "tags": [
            "reasoning",
            "nso",
            "grade10"
          ]
        },
        {
          "code": "NSO-G10-T5-S2",
          "name": "Olympiad Application",
          "description": "Advanced problem solving.",
          "learningObjectives": [
            "Apply concepts",
            "Solve Olympiad-style problems"
          ],
          "difficultyRange": [
            "easy",
            "medium",
            "hard"
          ],
          "recommendedQuestionCount": 17,
          "tags": [
            "olympiad",
            "nso",
            "grade10"
          ]
        }
      ]
    }
  ]
}